ResponseID,NPS_Score,Overall_Satisfaction,Agent_Mode_Rating,Code_Completion_Rating,Chat_Edit_Rating,Next_Edit_Suggestions_Rating,Model_Choice_Rating,Enterprise_Features_Rating,Performance_Rating,Ease_of_Use_Rating,What_Dont_You_Like,What_Would_You_Like_Added,General_Comments,User_Type,Experience_Level,Company_Size,Primary_Language
1,9,4,5,4,4,3,4,5,4,4,"Agent mode sometimes generates non-compliant code that doesn't pass our linters","Better integration with formatters and linters in agent mode","Love the potential of agent mode but needs polish",Professional,Senior,Large,TypeScript
2,8,4,4,5,4,2,3,4,4,4,"Next edit suggestions interrupt my workflow when using snippets","Option to configure next edit suggestions more granularly","Great for boilerplate code generation",Professional,Mid,Medium,JavaScript
3,7,3,3,4,4,3,4,3,3,3,"Agent mode is slow and often breaks things I've already fixed","Faster agent execution and better context retention","Sometimes feels like working with a junior developer",Professional,Senior,Large,Python
4,10,5,5,5,5,4,5,5,5,5,"Nothing major, just occasional hiccups with complex prompts","More model options and better prompt customization","This tool has revolutionized my coding workflow",Professional,Expert,Medium,Java
5,6,3,2,4,3,2,3,3,2,3,"Agent mode generates code that looks good but rarely runs correctly","Better error handling and self-correction in agent mode","Frustrating when it breaks working code repeatedly",Student,Beginner,Small,Python
6,9,4,4,4,5,3,4,4,4,4,"Sometimes the AI seems less sharp than direct API calls","Transparency about any prompt filtering or processing","Excellent for quick fixes and incremental changes",Professional,Senior,Large,C#
7,8,4,4,4,4,2,4,4,4,3,"Next edit suggestions are overwhelming and annoying","Ability to fine-tune suggestion frequency and timing","I've learned to constantly hit escape to dismiss suggestions",Professional,Mid,Medium,Go
8,5,2,2,3,3,2,3,2,2,3,"Agent mode uses up my quota quickly without delivering results","Better quota management and more efficient token usage","Feels like it generates tons of prompts for simple tasks",Professional,Mid,Small,Ruby
9,9,5,5,4,5,4,5,5,4,4,"Wish I could use it more but company policies restrict AI tools","Better enterprise compliance and governance features","Saved me weeks of work once I got approval",Professional,Senior,Enterprise,Java
10,7,4,3,4,4,3,3,4,3,4,"Documentation on prompt files and instructions could be better","More examples and templates for copilot-instructions.md","Still figuring out how to customize it effectively",Professional,Mid,Medium,TypeScript
11,8,4,4,4,4,3,4,4,4,4,"Claude 3.7 being temporarily disabled is frustrating","More reliable model availability and redundancy","Different models have different strengths for different tasks",Professional,Expert,Large,Python
12,6,3,3,3,3,2,3,3,3,3,"GPT-4 seems reluctant to use some tools in agent mode","Better tool utilization across all available models","Some models work better than others for agent tasks",Professional,Senior,Medium,JavaScript
13,10,5,5,5,5,5,5,5,5,5,"Honestly can't think of anything major to complain about","Keep doing what you're doing, maybe add more languages","Thank you for this awesome product, amazing work",Professional,Mid,Small,C++
14,4,2,1,3,2,1,2,2,2,2,"Agent mode is basically unusable, too many errors and failures","Complete redesign of agent architecture for reliability","More frustrating than helpful most of the time",Professional,Senior,Medium,Rust
15,9,4,5,4,4,3,4,4,4,4,"Would love more control over how agent mode approaches tasks","Step-by-step execution mode with human approval gates","Impressed by multi-file modifications that work correctly",Professional,Expert,Large,TypeScript
16,7,3,3,4,4,2,3,3,3,4,"Snippets workflow is completely broken with Copilot enabled","Better integration with existing VS Code snippet system","Had to disable next edit suggestions due to interference",Professional,Mid,Medium,Python
17,8,4,4,4,4,4,4,4,4,4,"Sometimes generates outdated or deprecated code patterns","Real-time knowledge updates and modern best practices","Great for learning new patterns and approaches",Student,Intermediate,Small,JavaScript
18,6,3,2,3,3,3,3,3,3,3,"Performance is inconsistent, sometimes very slow responses","Faster response times and better caching","Can be hit or miss depending on the complexity",Professional,Mid,Medium,Go
19,9,5,4,5,5,4,5,4,4,4,"Enterprise setup was complex and took too long to get approved","Streamlined enterprise onboarding and approval process","Productivity gains are massive once you get it working",Professional,Senior,Enterprise,C#
20,5,2,2,2,3,2,2,3,2,2,"Feels like I'm fighting the AI more than collaborating with it","Better understanding of user intent and context","Often generates solutions that miss the actual requirement",Professional,Senior,Large,Java
21,8,4,4,4,4,3,4,4,4,4,"Limited understanding of project-specific conventions and patterns","Project-aware suggestions based on existing codebase analysis","Works well for standard patterns but struggles with custom architectures",Professional,Expert,Large,Python
22,7,4,3,4,4,2,3,4,3,4,"Next edit suggestions pop up at the worst possible moments","Context-aware timing for suggestions based on user activity","Interrupts deep focus when I'm in the zone",Professional,Senior,Medium,TypeScript
23,9,4,5,4,4,4,4,5,4,4,"Wish I could save and share custom prompt templates with my team","Team-wide prompt template sharing and version control","Great for onboarding new developers with consistent patterns",Professional,Mid,Large,JavaScript
24,6,3,3,3,3,2,3,3,3,3,"Agent mode doesn't understand our specific testing frameworks","Better support for custom testing and build tools","Generates tests that don't match our existing patterns",Professional,Mid,Medium,Ruby
25,10,5,5,5,5,4,5,5,5,5,"Nothing significant, this tool is a game changer","Maybe add support for more niche programming languages","Completely transformed how I approach complex refactoring",Professional,Expert,Medium,Rust
26,4,2,1,3,2,1,2,2,2,2,"Agent mode creates more problems than it solves","Start over with a more reliable foundation","Constantly breaks working code and introduces bugs",Professional,Senior,Large,C++
27,8,4,4,4,4,3,4,4,4,4,"Documentation could be clearer about model differences and capabilities","Detailed comparison guide for choosing the right model","Each model seems to have different strengths and weaknesses",Professional,Mid,Medium,Python
28,7,3,3,4,3,2,3,3,3,3,"Too many false starts and incomplete suggestions","Better confidence scoring and suggestion quality filtering","Wastes time with low-quality suggestions that need fixing",Professional,Mid,Small,Go
29,9,4,4,4,5,4,4,4,4,4,"Sometimes struggles with modern framework syntax and patterns","Regular updates to support latest framework versions","Excellent for rapid prototyping and boilerplate generation",Professional,Senior,Medium,TypeScript
30,5,3,2,3,3,2,3,3,2,3,"Quota limits are too restrictive for serious development work","Higher quota limits or better usage optimization","Runs out of quota too quickly when doing complex work",Student,Intermediate,Small,JavaScript
31,8,4,4,4,4,3,4,4,4,4,"Lacks understanding of accessibility best practices","Built-in accessibility checking and suggestions","Could help make the web more accessible by default",Professional,Senior,Large,HTML/CSS
32,6,3,3,3,3,2,3,3,3,3,"Error messages from failed agent attempts are not helpful","Better debugging information when agent mode fails","Hard to understand why something didn't work",Professional,Mid,Medium,Python
33,9,5,5,4,5,4,5,4,4,5,"Would love offline mode for sensitive codebases","Local model options for enterprises with strict data policies","Amazing tool but data privacy concerns limit usage",Professional,Expert,Enterprise,Java
34,7,4,3,4,4,3,3,4,3,4,"Inconsistent code style even with project-specific instructions","Better adherence to existing code style and conventions","Generated code often doesn't match team standards",Professional,Mid,Large,C#
35,8,4,4,4,4,2,4,4,4,4,"Next edit suggestions don't respect current selection or context","Smarter context awareness for when to show suggestions","Suggestions often don't make sense for what I'm currently doing",Professional,Senior,Medium,TypeScript
36,5,2,2,2,3,2,2,2,2,2,"Agent mode is too unpredictable and unreliable for production use","Complete reliability overhaul before promoting as stable feature","Beta quality at best, not ready for serious development",Professional,Expert,Large,Python
37,10,5,5,5,5,5,5,5,5,5,"Honestly struggling to find meaningful complaints","Keep pushing the boundaries of what's possible","This is the future of software development",Professional,Senior,Medium,Multiple
38,7,3,3,4,3,2,3,3,3,3,"Doesn't understand domain-specific languages and frameworks well","Support for more specialized and niche technologies","Limited usefulness outside mainstream programming languages",Professional,Senior,Medium,COBOL
39,8,4,4,4,4,3,4,4,4,4,"Security scanning could be better integrated","Real-time security vulnerability detection and fixes","Would be great to catch security issues during generation",Professional,Senior,Enterprise,Java
40,6,3,2,3,3,3,3,3,3,3,"Takes too long to analyze large codebases","Faster indexing and analysis of existing project structure","Performance degrades significantly with large projects",Professional,Mid,Large,C++
41,9,4,5,4,4,4,4,5,4,4,"Limited support for infrastructure as code and DevOps workflows","Better integration with Terraform, Kubernetes, and CI/CD","Great for application code but weak on infrastructure",Professional,Expert,Large,Terraform
42,4,2,1,2,2,1,2,2,2,2,"Agent mode gets stuck in loops and doesn't know when to stop","Circuit breakers and better failure detection","Wastes enormous amounts of time on doomed approaches",Professional,Senior,Medium,Python
43,8,4,4,4,4,3,4,4,4,4,"Could be smarter about suggesting relevant libraries and dependencies","Dependency suggestion and automatic package management","Often generates code that requires manual dependency installation",Professional,Mid,Medium,JavaScript
44,7,4,3,4,4,2,3,4,3,4,"Next edit suggestions conflict with my muscle memory and shortcuts","Customizable keybindings for suggestion acceptance/dismissal","Interferes with established keyboard shortcuts",Professional,Senior,Large,TypeScript
45,9,5,4,5,5,4,5,4,4,4,"Documentation generation could be more comprehensive","Automated documentation generation with examples","Excellent at generating code but docs are an afterthought",Professional,Expert,Medium,Python
46,5,3,2,3,3,2,3,3,2,3,"Model switching is confusing and not well explained","Clearer guidance on when to use which model","Don't understand the differences between available models",Student,Beginner,Small,JavaScript
47,8,4,4,4,4,3,4,4,4,4,"Limited understanding of design patterns and architectural principles","Pattern recognition and architectural guidance","Could help enforce better software design practices",Professional,Senior,Large,Java
48,6,3,3,3,3,2,3,3,3,3,"Generates too much boilerplate without understanding the actual need","More intelligent code generation that focuses on business logic","Tends to over-engineer simple solutions",Professional,Mid,Medium,C#
49,9,4,5,4,4,4,4,4,4,4,"Version control integration could be smarter","Git-aware suggestions and conflict resolution","Would be great if it understood version control context",Professional,Senior,Medium,Multiple
50,7,3,3,4,3,2,3,3,3,3,"Performance testing and optimization suggestions are lacking","Built-in performance analysis and optimization recommendations","Could help identify performance bottlenecks automatically",Professional,Expert,Large,Python
51,8,4,4,4,4,3,4,4,4,4,"Database query optimization could be much better","Intelligent SQL query analysis and optimization suggestions","Generates functional but inefficient database queries",Professional,Senior,Large,SQL
52,5,2,2,2,2,1,2,2,2,2,"Agent mode feels like a very junior developer who makes careless mistakes","Much better testing and validation before suggesting changes","Code looks plausible but rarely works correctly on first try",Professional,Expert,Medium,Rust
53,9,5,5,4,5,4,5,5,4,5,"Mobile development support could be expanded","Better support for iOS/Android specific patterns","Excellent for web but limited for mobile development",Professional,Mid,Medium,Swift
54,6,3,3,3,3,2,3,3,3,3,"Debugging assistance is practically nonexistent","Interactive debugging help and error analysis","Great at writing code but terrible at helping fix problems",Professional,Mid,Large,Python
55,8,4,4,4,4,3,4,4,4,4,"Multi-language project support needs improvement","Better context switching between different languages in same project","Struggles when projects mix multiple programming languages",Professional,Senior,Large,Multiple
56,7,4,3,4,4,2,3,4,3,4,"UI/UX suggestions are generic and not very helpful","Design-aware suggestions for frontend development","Could be much smarter about user interface best practices",Professional,Mid,Medium,React
57,10,5,5,5,5,4,5,5,5,5,"Can't think of any major issues worth mentioning","Continue the excellent work and keep improving","This tool has made me a significantly more productive developer",Professional,Expert,Small,Multiple
58,4,2,1,2,2,1,2,2,2,2,"Constantly suggests deprecated or insecure coding practices","Real-time best practice validation and security checking","Generates code that fails security reviews",Professional,Senior,Enterprise,PHP
59,8,4,4,4,4,3,4,4,4,4,"Integration with external APIs and services could be smarter","API documentation integration and usage examples","Often generates incorrect API usage patterns",Professional,Mid,Medium,JavaScript
60,6,3,2,3,3,3,3,3,3,3,"Learning curve is steeper than expected","Better onboarding and tutorial materials","Took longer than expected to become productive",Student,Intermediate,Small,Python
61,9,4,5,4,4,4,4,4,4,4,"Code review integration would be extremely valuable","Integration with GitHub PR reviews and suggestions","Would love AI assistance during code review process",Professional,Senior,Large,TypeScript
62,7,3,3,4,3,2,3,3,3,3,"Refactoring suggestions are often too aggressive or risky","More conservative refactoring with safety checks","Sometimes suggests changes that break existing functionality",Professional,Senior,Medium,Java
63,8,4,4,4,4,3,4,4,4,4,"Testing strategy suggestions could be more comprehensive","Intelligent test coverage analysis and gap identification","Good at generating individual tests but poor at test strategy",Professional,Expert,Large,Python
64,5,3,2,3,3,2,3,3,2,3,"Pricing model doesn't make sense for individual developers","More affordable tiers for freelancers and students","Too expensive for the value provided at current pricing",Freelancer,Mid,Individual,Multiple
65,9,5,4,5,5,4,5,4,4,4,"Documentation could better explain prompt engineering best practices","Comprehensive guide to getting the most out of Copilot","Trial and error approach to finding what works best",Professional,Senior,Medium,Python
66,6,3,3,3,3,2,3,3,3,3,"Performance monitoring and profiling integration is missing","Built-in performance analysis and bottleneck detection","Could help optimize code during development rather than after",Professional,Mid,Large,C++
67,8,4,4,4,4,3,4,4,4,4,"Microservices architecture guidance could be much better","Service boundary suggestions and API design guidance","Tends to generate monolithic solutions even for distributed systems",Professional,Expert,Enterprise,Multiple
68,7,4,3,4,4,2,3,4,3,4,"Next edit suggestions don't understand my coding rhythm","Adaptive learning from user behavior and preferences","Should learn when I want suggestions and when I don't",Professional,Senior,Medium,TypeScript
69,9,4,5,4,4,4,4,5,4,4,"Cloud deployment suggestions could be more comprehensive","Intelligent cloud architecture recommendations","Great for local development but weak on deployment strategies",Professional,Senior,Large,Python
70,4,2,1,2,2,1,2,2,2,2,"Agent mode creates technical debt faster than I can clean it up","Quality gates and technical debt prevention","Generates code that works but is unmaintainable",Professional,Expert,Large,Java
71,8,4,4,4,4,3,4,4,4,4,"Accessibility testing integration would be valuable","Automated accessibility testing and compliance checking","Could help ensure inclusive design from the start",Professional,Mid,Medium,HTML/CSS
72,6,3,3,3,3,2,3,3,3,3,"Configuration management for different projects is cumbersome","Project-specific configuration profiles and templates","Settings don't adapt well to different project types",Professional,Mid,Medium,Multiple
73,9,5,5,4,5,4,5,4,4,5,"Advanced search and discovery features for generated code","Better organization and searchability of AI-generated suggestions","Hard to find and reuse previous AI suggestions",Professional,Senior,Large,TypeScript
74,7,3,3,4,3,2,3,3,3,3,"Integration with project management tools would be helpful","Ticket and requirement integration for context-aware suggestions","Could generate better code with access to project requirements",Professional,Mid,Large,Multiple
75,8,4,4,4,4,3,4,4,4,4,"Code quality metrics integration would be extremely useful","Real-time code quality scoring and improvement suggestions","Could help maintain high standards during development",Professional,Expert,Medium,Python
76,5,2,2,2,3,2,2,3,2,2,"Feels like using a powerful tool without proper training","Much better documentation and learning resources","Potential is huge but hard to unlock without guidance",Student,Beginner,Small,JavaScript
77,9,4,5,4,4,4,4,4,4,4,"Collaborative features for team development could be expanded","Team-wide learning and shared AI insights","Would be great to share AI learnings across team members",Professional,Senior,Large,Multiple
78,6,3,2,3,3,3,3,3,3,3,"Legacy code modernization assistance is practically nonexistent","Intelligent legacy code analysis and modernization suggestions","Could help with technical debt reduction in older codebases",Professional,Senior,Enterprise,COBOL
79,8,4,4,4,4,3,4,4,4,4,"Internationalization and localization support needs improvement","Better i18n/l10n patterns and best practice suggestions","Weak on building globally accessible applications",Professional,Mid,Medium,Multiple
80,7,4,3,4,4,2,3,4,3,4,"Real-time collaboration features with other developers using AI","Shared AI context and collaborative prompt engineering","Could enhance pair programming and team development",Professional,Senior,Medium,TypeScript
81,9,5,4,5,5,4,5,5,4,4,"Enterprise security features could be more comprehensive","Advanced security scanning and compliance reporting","Excellent tool but needs better enterprise security integration",Professional,Expert,Enterprise,Java
82,4,2,1,2,2,1,2,2,2,2,"Agent mode is fundamentally flawed and unreliable","Complete architectural redesign focused on reliability","More of a tech demo than a production-ready feature",Professional,Expert,Large,C++
83,8,4,4,4,4,3,4,4,4,4,"API documentation generation could be much more intelligent","Automated API documentation with examples and use cases","Could revolutionize how we document and share APIs",Professional,Senior,Medium,Python
84,6,3,3,3,3,2,3,3,3,3,"Learning from previous mistakes and corrections is limited","Better feedback loop and learning from user corrections","Makes the same mistakes repeatedly instead of learning",Professional,Mid,Medium,JavaScript
85,9,4,5,4,4,4,4,4,4,4,"Integration with design tools and mockups would be valuable","Design-to-code generation from Figma and other design tools","Could bridge the gap between design and development",Professional,Mid,Large,React
86,7,3,3,4,3,2,3,3,3,3,"Code generation for edge cases and error handling is poor","Better exception handling and edge case coverage","Generates happy path code but ignores error scenarios",Professional,Senior,Medium,Python
87,8,4,4,4,4,3,4,4,4,4,"Continuous integration and deployment suggestions could be smarter","Intelligent CI/CD pipeline generation and optimization","Could automate DevOps best practices during development",Professional,Expert,Large,Multiple
88,5,3,2,3,3,2,3,3,2,3,"Subscription management and billing transparency needs improvement","Clearer usage tracking and predictable billing","Hard to understand what I'm being charged for",Freelancer,Mid,Individual,Multiple
89,9,5,5,4,5,4,5,4,4,5,"Advanced prompt templates and reusable components would be great","Library of proven prompt patterns and templates","Could help standardize AI interactions across projects",Professional,Senior,Large,TypeScript
90,6,3,3,3,3,2,3,3,3,3,"Integration testing suggestions are inadequate","Intelligent integration test generation and API testing","Good at unit tests but poor at system-level testing",Professional,Mid,Medium,Java
91,8,4,4,4,4,3,4,4,4,4,"Performance optimization suggestions could be more sophisticated","Advanced performance profiling and optimization recommendations","Could identify performance issues before they become problems",Professional,Expert,Large,C++
92,7,4,3,4,4,2,3,4,3,4,"Multi-platform development support needs significant improvement","Better cross-platform development patterns and suggestions","Struggles with platform-specific requirements and constraints",Professional,Senior,Medium,Multiple
93,9,4,5,4,4,4,4,5,4,4,"Advanced analytics on AI usage and productivity gains would be valuable","Detailed metrics on AI assistance effectiveness and ROI","Would love to measure the actual productivity impact",Professional,Expert,Enterprise,Multiple
94,4,2,1,2,2,1,2,2,2,2,"Suggestion quality is inconsistent and often misleading","Much better quality control and relevance filtering","Too many low-quality suggestions that waste time",Professional,Mid,Medium,Python
95,8,4,4,4,4,3,4,4,4,4,"Machine learning and AI development support could be expanded","Better support for ML/AI specific libraries and patterns","Limited understanding of data science and ML workflows",Professional,Senior,Large,Python
96,6,3,2,3,3,3,3,3,3,3,"Onboarding process for new teams is overly complex","Streamlined team setup and configuration management","Takes too long to get entire teams productive",Professional,Mid,Large,Multiple
97,9,5,4,5,5,4,5,4,4,4,"Advanced customization options for enterprise deployments","More granular control over AI behavior and restrictions","Excellent foundation but needs more enterprise flexibility",Professional,Expert,Enterprise,Java
98,7,3,3,4,3,2,3,3,3,3,"Code generation doesn't respect existing architectural decisions","Better understanding of project architecture and constraints","Often suggests solutions that don't fit existing patterns",Professional,Senior,Large,C#
99,8,4,4,4,4,3,4,4,4,4,"Integration with other development tools could be much deeper","Native integration with popular IDEs and development environments","Could be more than just a VS Code feature",Professional,Mid,Medium,Multiple
100,5,2,2,2,3,2,2,3,2,2,"Learning resources and community support are insufficient","Comprehensive training materials and active community forums","Hard to get help when things don't work as expected",Student,Intermediate,Small,JavaScript
101,9,4,5,4,4,4,4,4,4,4,"Advanced search capabilities for finding relevant code patterns","Intelligent code search across repositories and projects","Could help discover and reuse existing solutions",Professional,Senior,Large,TypeScript
102,6,3,3,3,3,2,3,3,3,3,"Suggestion filtering and customization options are too limited","More granular control over what types of suggestions to receive","One size fits all approach doesn't work for all developers",Professional,Mid,Medium,Python
103,8,4,4,4,4,3,4,4,4,4,"Code review automation and assistance could be revolutionary","Automated code review suggestions and quality checking","Could significantly improve code review efficiency",Professional,Expert,Large,Multiple
104,7,4,3,4,4,2,3,4,3,4,"Integration with version control workflows needs improvement","Better understanding of git workflows and branching strategies","Could be smarter about when and how to suggest changes",Professional,Senior,Medium,Multiple
105,9,5,5,4,5,4,5,5,4,5,"Advanced prompt engineering tools for power users","Visual prompt builder and template management system","Could unlock even more potential for experienced users",Professional,Expert,Medium,Multiple
106,4,2,1,2,2,1,2,2,2,2,"Reliability issues make it unsuitable for professional development","Complete overhaul of error handling and quality assurance","Too many failures and inconsistencies for production use",Professional,Expert,Large,Rust
107,8,4,4,4,4,3,4,4,4,4,"Database design and optimization suggestions could be much better","Intelligent database schema design and query optimization","Weak on data modeling and database performance",Professional,Senior,Large,SQL
108,6,3,2,3,3,3,3,3,3,3,"Setup and configuration for complex projects is too difficult","Automated project setup and configuration detection","Should be able to understand project structure automatically",Professional,Mid,Medium,Multiple
109,9,4,5,4,4,4,4,4,4,4,"Advanced debugging assistance would be incredibly valuable","Interactive debugging support and error analysis","Could revolutionize the debugging experience",Professional,Senior,Large,Python
110,7,3,3,4,3,2,3,3,3,3,"Code generation often ignores existing patterns and conventions","Better analysis of existing codebase for pattern matching","Should adapt to existing code style and architecture",Professional,Senior,Medium,Java
111,8,4,4,4,4,3,4,4,4,4,"Testing framework integration could be much more sophisticated","Intelligent test generation based on code coverage analysis","Could help achieve better test coverage automatically",Professional,Expert,Large,Multiple
