ResponseID,NPS_Score,Overall_Satisfaction,Agent_Mode_Rating,Code_Completion_Rating,Chat_Edit_Rating,Next_Edit_Suggestions_Rating,Model_Choice_Rating,Enterprise_Features_Rating,Performance_Rating,Ease_of_Use_Rating,What_Dont_You_Like,What_Would_You_Like_Added,General_Comments,User_Type,Experience_Level,Company_Size,Primary_Language
112,5,3,2,3,3,2,3,3,2,3,"Cost transparency and usage prediction tools are missing","Better cost estimation and budget management tools","Hard to predict and control costs for larger teams",Professional,Mid,Large,Multiple
113,9,5,4,5,5,4,5,4,4,5,"Advanced team collaboration features would be game-changing","Shared AI context and collaborative development tools","Could transform how teams work together on code",Professional,Expert,Enterprise,TypeScript
114,6,3,3,3,3,2,3,3,3,3,"Security scanning integration is superficial and inadequate","Deep security analysis and vulnerability detection","Could prevent security issues rather than just flagging them",Professional,Senior,Enterprise,Multiple
115,8,4,4,4,4,3,4,4,4,4,"Code refactoring suggestions could be much more intelligent","Advanced refactoring with safety analysis and impact assessment","Could help modernize and improve existing codebases safely",Professional,Expert,Large,C++
116,7,4,3,4,4,2,3,4,3,4,"Integration with project planning and requirement tools needed","Requirements-aware code generation and task management","Could bridge the gap between planning and implementation",Professional,Senior,Large,Multiple
117,9,4,5,4,4,4,4,5,4,4,"Advanced metrics and analytics for development productivity","Comprehensive productivity tracking and improvement insights","Would love to see measurable impact on development speed",Professional,Expert,Medium,Multiple
118,4,2,1,2,2,1,2,2,2,2,"Agent mode creates more technical debt than value","Fundamental rethinking of automated code generation approach","Current implementation is counterproductive for serious development",Professional,Expert,Large,Python
119,8,4,4,4,4,3,4,4,4,4,"API integration and external service suggestions could be smarter","Intelligent API discovery and integration assistance","Could automate much of the boilerplate for external integrations",Professional,Mid,Medium,JavaScript
120,6,3,3,3,3,2,3,3,3,3,"Learning curve for advanced features is unnecessarily steep","Better progressive disclosure and feature introduction","Too many advanced features without proper guidance",Professional,Mid,Medium,Multiple
121,9,5,5,4,5,4,5,4,4,4,"Advanced customization for different development methodologies","Support for Agile, TDD, and other development approaches","Could adapt to different team processes and methodologies",Professional,Senior,Large,Multiple
122,7,3,3,4,3,2,3,3,3,3,"Code generation doesn't consider performance implications","Performance-aware code generation with optimization suggestions","Could generate faster code by default",Professional,Expert,Large,C++
123,8,4,4,4,4,3,4,4,4,4,"Infrastructure as code support needs significant expansion","Better support for cloud infrastructure and deployment automation","Could revolutionize DevOps and infrastructure management",Professional,Senior,Enterprise,Terraform
124,5,2,2,2,3,2,2,3,2,2,"Documentation and help resources are scattered and incomplete","Centralized, comprehensive documentation with examples","Hard to find answers to specific questions and use cases",Student,Beginner,Small,Multiple
125,9,4,5,4,4,4,4,4,4,4,"Advanced prompt optimization and suggestion improvement tools","AI-powered prompt optimization and effectiveness analysis","Could help users get better results with less effort",Professional,Expert,Medium,Multiple
126,6,3,2,3,3,3,3,3,3,3,"Integration with continuous deployment pipelines is limited","Native CI/CD integration with deployment automation","Could automate more of the development-to-production pipeline",Professional,Mid,Large,Multiple
127,8,4,4,4,4,3,4,4,4,4,"Code quality enforcement could be much more sophisticated","Automated code quality gates and improvement suggestions","Could maintain high standards without manual intervention",Professional,Senior,Large,Java
128,7,4,3,4,4,2,3,4,3,4,"Multi-repository and monorepo support needs improvement","Better understanding of complex repository structures","Struggles with large, complex codebases and dependencies",Professional,Expert,Enterprise,Multiple
129,9,5,4,5,5,4,5,5,4,5,"Advanced error prediction and prevention capabilities","Predictive error analysis and prevention suggestions","Could catch issues before they become problems",Professional,Expert,Large,Python
130,4,2,1,2,2,1,2,2,2,2,"Suggestion quality control is fundamentally broken","Complete overhaul of suggestion filtering and ranking","Too many irrelevant or incorrect suggestions",Professional,Senior,Medium,Multiple
131,8,4,4,4,4,3,4,4,4,4,"Advanced dependency management and suggestion capabilities","Intelligent dependency analysis and optimization recommendations","Could help manage complex dependency trees automatically",Professional,Mid,Medium,JavaScript
132,6,3,3,3,3,2,3,3,3,3,"Team training and adoption support is inadequate","Comprehensive training programs and adoption assistance","Hard to get entire teams up to speed effectively",Professional,Mid,Large,Multiple
133,9,4,5,4,4,4,4,4,4,4,"Advanced code analytics and pattern recognition tools","Deep code analysis and architectural insight generation","Could provide valuable insights into codebase health",Professional,Expert,Large,TypeScript
134,7,3,3,4,3,2,3,3,3,3,"Legacy system integration and modernization support is weak","Intelligent legacy code analysis and modernization planning","Could help with technical debt reduction strategies",Professional,Senior,Enterprise,COBOL
135,8,4,4,4,4,3,4,4,4,4,"Advanced testing strategy and coverage optimization needed","Intelligent test strategy development and gap analysis","Could revolutionize how we approach software testing",Professional,Expert,Large,Multiple
136,5,3,2,3,3,2,3,3,2,3,"Billing and subscription management tools are confusing","Transparent usage tracking and predictable billing models","Hard to understand and control costs effectively",Freelancer,Mid,Individual,Multiple
137,9,5,5,4,5,4,5,4,4,5,"Advanced collaboration tools for distributed teams","Enhanced remote collaboration and shared AI context","Could transform distributed software development",Professional,Senior,Large,Multiple
138,6,3,3,3,3,2,3,3,3,3,"Performance profiling and optimization integration is missing","Real-time performance analysis and optimization suggestions","Could identify and fix performance issues during development",Professional,Mid,Large,C++
139,8,4,4,4,4,3,4,4,4,4,"Advanced prompt template management and sharing capabilities","Enterprise-grade prompt template library and version control","Could standardize AI interactions across large organizations",Professional,Expert,Enterprise,Multiple
140,7,4,3,4,4,2,3,4,3,4,"Integration with design systems and component libraries needed","Design system aware code generation and component suggestions","Could bridge design and development more effectively",Professional,Senior,Medium,React
141,9,4,5,4,4,4,4,5,4,4,"Advanced security analysis and threat modeling capabilities","Intelligent security analysis and threat detection","Could build security into development from the ground up",Professional,Expert,Enterprise,Multiple
142,4,2,1,2,2,1,2,2,2,2,"Current implementation is too unreliable for professional use","Ground-up redesign focused on reliability and consistency","Beta quality features marketed as production ready",Professional,Expert,Large,Rust
143,8,4,4,4,4,3,4,4,4,4,"Advanced data analysis and visualization code generation","Intelligent data science and analytics code generation","Could democratize data analysis and visualization",Professional,Senior,Large,Python
144,6,3,2,3,3,3,3,3,3,3,"Onboarding complexity discourages adoption in smaller teams","Simplified setup and configuration for small teams","Too complex for teams without dedicated DevOps resources",Professional,Mid,Small,Multiple
145,9,5,4,5,5,4,5,4,4,4,"Advanced machine learning integration and model deployment","ML-aware code generation and model deployment automation","Could revolutionize ML development and deployment workflows",Professional,Expert,Large,Python
146,7,3,3,4,3,2,3,3,3,3,"Code generation often produces outdated or deprecated patterns","Real-time best practice updates and modern pattern suggestions","Generated code sometimes fails modern linting and security tools",Professional,Senior,Medium,JavaScript
147,8,4,4,4,4,3,4,4,4,4,"Advanced project templating and scaffolding capabilities","Intelligent project setup and architecture generation","Could automate initial project setup and configuration",Professional,Mid,Medium,Multiple
148,5,2,2,2,3,2,2,3,2,2,"Support and troubleshooting resources are insufficient","Dedicated support channels and comprehensive troubleshooting guides","Hard to get help when encountering problems or edge cases",Professional,Mid,Medium,Multiple
149,9,4,5,4,4,4,4,4,4,4,"Advanced code search and discovery across multiple repositories","Enterprise-wide code search and pattern discovery","Could help find and reuse existing solutions across organizations",Professional,Expert,Enterprise,Multiple
150,6,3,3,3,3,2,3,3,3,3,"Suggestion relevance and context awareness needs significant improvement","Much better understanding of current development context","Too many suggestions that don't fit current task or workflow",Professional,Senior,Large,TypeScript
151,8,4,4,4,4,3,4,4,4,4,"Advanced deployment automation and infrastructure management","Intelligent deployment pipeline generation and management","Could automate much of the DevOps workflow",Professional,Expert,Large,Multiple
152,7,4,3,4,4,2,3,4,3,4,"Integration with project management and tracking tools needed","Requirements-driven development with task integration","Could connect code generation directly to project requirements",Professional,Senior,Large,Multiple
153,9,5,5,4,5,4,5,5,4,5,"Advanced team productivity analytics and optimization","Comprehensive team productivity insights and optimization recommendations","Could help optimize entire development organizations",Professional,Expert,Enterprise,Multiple
154,4,2,1,2,2,1,2,2,2,2,"Feature stability and reliability are major concerns","Focus on stability before adding new features","Too many half-working features instead of reliable core functionality",Professional,Senior,Large,Java
155,8,4,4,4,4,3,4,4,4,4,"Advanced API design and documentation generation capabilities","Intelligent API design assistance and automatic documentation","Could revolutionize how we design and document APIs",Professional,Senior,Medium,Multiple
156,6,3,2,3,3,3,3,3,3,3,"Learning curve for effective usage is steeper than advertised","Better progressive learning and skill development tools","Takes significant investment to become truly productive",Professional,Mid,Medium,Multiple
157,9,4,5,4,4,4,4,4,4,4,"Advanced code quality prediction and improvement suggestions","Predictive code quality analysis and improvement recommendations","Could prevent quality issues before they enter the codebase",Professional,Expert,Large,Python
158,7,3,3,4,3,2,3,3,3,3,"Multi-language project support is inconsistent and limited","Better support for polyglot development environments","Struggles when projects use multiple programming languages",Professional,Senior,Large,Multiple
159,8,4,4,4,4,3,4,4,4,4,"Advanced debugging and troubleshooting assistance needed","Interactive debugging support with intelligent error analysis","Could transform the debugging experience for complex issues",Professional,Expert,Large,C++
160,5,3,2,3,3,2,3,3,2,3,"Cost-benefit analysis for smaller organizations is unclear","Better ROI tools and cost-benefit analysis for decision making","Hard to justify cost without clear productivity metrics",Professional,Mid,Medium,Multiple
161,9,5,4,5,5,4,5,4,4,5,"Advanced customization for industry-specific development needs","Industry-specific templates and best practice integration","Could adapt to specific industry requirements and regulations",Professional,Expert,Enterprise,Multiple
162,6,3,3,3,3,2,3,3,3,3,"Code generation doesn't consider maintainability implications","Maintainability-focused code generation with long-term considerations","Generated code is often hard to maintain and extend",Professional,Senior,Large,Java
163,8,4,4,4,4,3,4,4,4,4,"Advanced testing automation and quality assurance integration","Comprehensive testing automation with quality gates","Could automate much of the QA process during development",Professional,Expert,Large,Multiple
164,7,4,3,4,4,2,3,4,3,4,"Integration with continuous learning and skill development tools","Personalized learning recommendations based on code patterns","Could help developers improve skills through AI feedback",Professional,Mid,Medium,Multiple
165,9,4,5,4,4,4,4,5,4,4,"Advanced analytics for measuring development productivity impact","Detailed productivity metrics and improvement tracking","Would love quantitative evidence of productivity improvements",Professional,Expert,Medium,Multiple
166,4,2,1,2,2,1,2,2,2,2,"Quality assurance for AI-generated code is fundamentally inadequate","Rigorous testing and validation of all generated code","Too much responsibility placed on developers to verify AI output",Professional,Expert,Large,C#
167,8,4,4,4,4,3,4,4,4,4,"Advanced dependency analysis and security vulnerability detection","Intelligent dependency management with security scanning","Could prevent security vulnerabilities in dependencies",Professional,Senior,Enterprise,Multiple
168,6,3,3,3,3,2,3,3,3,3,"Team adoption strategies and change management support needed","Comprehensive change management and adoption assistance","Hard to successfully roll out to larger development teams",Professional,Mid,Large,Multiple
169,9,5,5,4,5,4,5,4,4,4,"Advanced prompt optimization with feedback learning capabilities","AI-powered prompt improvement and effectiveness optimization","Could continuously improve AI interactions based on outcomes",Professional,Expert,Large,Multiple
170,7,3,3,4,3,2,3,3,3,3,"Code generation often misses important edge cases and error scenarios","Better edge case analysis and comprehensive error handling","Generates happy path solutions that fail in real-world scenarios",Professional,Senior,Medium,Python
171,8,4,4,4,4,3,4,4,4,4,"Advanced architecture analysis and improvement recommendations","Intelligent architecture assessment and modernization suggestions","Could help improve and modernize existing software architectures",Professional,Expert,Large,Multiple
172,5,2,2,2,3,2,2,3,2,2,"Documentation quality and completeness are major weaknesses","Comprehensive, searchable documentation with real examples","Current docs are scattered and lack practical examples",Student,Intermediate,Small,Multiple
173,9,4,5,4,4,4,4,4,4,4,"Advanced collaboration features for code review and pair programming","Enhanced collaborative development with shared AI context","Could revolutionize how teams collaborate on code",Professional,Senior,Large,TypeScript
174,6,3,2,3,3,3,3,3,3,3,"Performance impact on IDE and development environment is noticeable","Better performance optimization and resource management","Slows down VS Code and increases memory usage significantly",Professional,Mid,Medium,Multiple
175,8,4,4,4,4,3,4,4,4,4,"Advanced project analysis and technical debt identification","Comprehensive project health analysis and improvement recommendations","Could help identify and prioritize technical debt reduction",Professional,Expert,Large,Java
176,7,4,3,4,4,2,3,4,3,4,"Integration with design tools and prototyping environments needed","Design-to-code generation with modern design tool integration","Could bridge the gap between design and implementation",Professional,Senior,Medium,React
177,9,5,4,5,5,4,5,5,4,5,"Advanced enterprise security and compliance management features","Comprehensive security and compliance automation","Excellent tool but needs better enterprise security integration",Professional,Expert,Enterprise,Multiple
178,4,2,1,2,2,1,2,2,2,2,"Fundamental reliability issues make it unsuitable for critical development","Complete redesign focused on predictability and reliability","Current approach is too experimental for production development",Professional,Expert,Large,Rust
179,8,4,4,4,4,3,4,4,4,4,"Advanced data modeling and database design assistance needed","Intelligent database design and data architecture recommendations","Could help with complex data modeling and optimization challenges",Professional,Senior,Large,SQL
180,6,3,3,3,3,2,3,3,3,3,"Setup complexity discourages adoption for individual developers","Simplified installation and configuration for solo developers","Too much overhead for individual developers and small projects",Freelancer,Mid,Individual,Multiple
181,9,4,5,4,4,4,4,4,4,4,"Advanced code migration and modernization capabilities","Intelligent code migration between frameworks and languages","Could automate complex migration and modernization projects",Professional,Expert,Large,Multiple
182,7,3,3,4,3,2,3,3,3,3,"Suggestion quality varies dramatically depending on context","More consistent suggestion quality across different scenarios","Great in some situations but terrible in others",Professional,Senior,Medium,Python
183,8,4,4,4,4,3,4,4,4,4,"Advanced performance optimization and profiling integration","Real-time performance analysis with optimization recommendations","Could identify and fix performance issues during development",Professional,Expert,Large,C++
184,5,3,2,3,3,2,3,3,2,3,"Training materials and best practice guides are insufficient","Comprehensive training programs and certification options","Hard to become truly proficient without proper training",Professional,Mid,Medium,Multiple
185,9,5,5,4,5,4,5,4,4,5,"Advanced team workflow optimization and process improvement","Intelligent workflow analysis and process optimization recommendations","Could help optimize entire development processes",Professional,Expert,Enterprise,Multiple
186,6,3,3,3,3,2,3,3,3,3,"Code generation doesn't respect existing testing strategies","Better integration with existing testing frameworks and strategies","Generated code often doesn't match established testing patterns",Professional,Senior,Large,Java
187,8,4,4,4,4,3,4,4,4,4,"Advanced CI/CD pipeline generation and optimization capabilities","Intelligent pipeline design and optimization recommendations","Could automate DevOps best practices and pipeline optimization",Professional,Expert,Large,Multiple
188,7,4,3,4,4,2,3,4,3,4,"Integration with requirement management and specification tools","Requirements-driven development with specification integration","Could generate code directly from detailed requirements",Professional,Senior,Large,Multiple
189,9,4,5,4,4,4,4,5,4,4,"Advanced metrics and KPI tracking for development productivity","Comprehensive productivity analytics and improvement insights","Would love detailed metrics on AI impact and effectiveness",Professional,Expert,Medium,Multiple
190,4,2,1,2,2,1,2,2,2,2,"Agent mode implementation is fundamentally flawed and unreliable","Complete rethinking of automated development assistance approach","Current agent mode is more hindrance than help",Professional,Expert,Large,Python
191,8,4,4,4,4,3,4,4,4,4,"Advanced security code analysis and vulnerability prevention","Proactive security analysis with vulnerability prevention","Could build security into code from the beginning",Professional,Senior,Enterprise,Multiple
192,6,3,2,3,3,3,3,3,3,3,"Learning resources for advanced usage patterns are lacking","Advanced tutorials and best practice documentation","Basic docs are okay but advanced usage is poorly documented",Professional,Mid,Medium,Multiple
193,9,5,4,5,5,4,5,4,4,4,"Advanced prompt template sharing and collaboration features","Enterprise prompt template management and sharing","Could standardize AI interactions across large organizations",Professional,Expert,Enterprise,TypeScript
194,7,3,3,4,3,2,3,3,3,3,"Code generation often produces solutions that don't scale well","Scalability-aware code generation with performance considerations","Generated solutions often need significant refactoring for production",Professional,Senior,Large,Java
195,8,4,4,4,4,3,4,4,4,4,"Advanced project scaffolding and architecture generation capabilities","Intelligent project setup with best practice architecture","Could automate initial project structure and configuration",Professional,Expert,Medium,Multiple
196,5,2,2,2,3,2,2,3,2,2,"Support responsiveness and issue resolution are inadequate","Faster support response times and better issue tracking","Takes too long to get help with problems and edge cases",Professional,Mid,Medium,Multiple
197,9,4,5,4,4,4,4,4,4,4,"Advanced code analysis and pattern recognition across repositories","Multi-repository pattern analysis and code reuse recommendations","Could help identify and reuse patterns across multiple projects",Professional,Expert,Large,Multiple
198,6,3,3,3,3,2,3,3,3,3,"Suggestion filtering and personalization options are too limited","Advanced personalization and suggestion customization","One-size-fits-all approach doesn't work for different developers",Professional,Senior,Medium,Python
199,8,4,4,4,4,3,4,4,4,4,"Advanced deployment automation with environment management","Intelligent environment-specific deployment and configuration","Could automate complex deployment scenarios across environments",Professional,Expert,Large,Multiple
200,7,4,3,4,4,2,3,4,3,4,"Integration with monitoring and observability tools needed","Runtime monitoring integration with proactive issue detection","Could connect development-time insights with production monitoring",Professional,Senior,Large,Multiple
201,9,5,5,4,5,4,5,5,4,5,"Advanced enterprise governance and policy enforcement features","Comprehensive governance with automated policy enforcement","Excellent foundation but needs better enterprise control features",Professional,Expert,Enterprise,Multiple
202,4,2,1,2,2,1,2,2,2,2,"Reliability and consistency issues undermine productivity gains","Focus on core reliability before adding advanced features","Unreliable features cause more problems than they solve",Professional,Senior,Large,C++
203,8,4,4,4,4,3,4,4,4,4,"Advanced API testing and integration validation capabilities","Intelligent API testing and integration validation","Could automate API testing and integration verification",Professional,Mid,Medium,JavaScript
204,6,3,3,3,3,2,3,3,3,3,"Team coordination and shared context management are inadequate","Better team coordination and shared AI context management","Hard to maintain consistency across team members",Professional,Mid,Large,Multiple
205,9,4,5,4,4,4,4,4,4,4,"Advanced code quality prediction with preventive recommendations","Predictive quality analysis with preventive measures","Could prevent quality issues before they enter codebase",Professional,Expert,Large,Python
206,7,3,3,4,3,2,3,3,3,3,"Multi-platform development support needs significant improvement","Better cross-platform development patterns and constraints","Weak support for platform-specific development requirements",Professional,Senior,Medium,Multiple
207,8,4,4,4,4,3,4,4,4,4,"Advanced debugging assistance with intelligent error analysis","Interactive debugging with AI-powered error diagnosis","Could revolutionize debugging complex issues and root cause analysis",Professional,Expert,Large,Java
208,5,3,2,3,3,2,3,3,2,3,"Cost structure and pricing model need better transparency","Clear cost prediction and budget management tools","Hard to predict and control costs for variable usage patterns",Freelancer,Mid,Individual,Multiple
209,9,5,4,5,5,4,5,4,4,5,"Advanced collaboration tools for distributed development teams","Enhanced remote collaboration with shared development context","Could transform how distributed teams work together effectively",Professional,Expert,Enterprise,Multiple
210,6,3,3,3,3,2,3,3,3,3,"Performance optimization suggestions are generic and unhelpful","Sophisticated performance analysis with specific optimization recommendations","Could provide much more targeted performance improvement advice",Professional,Senior,Large,C++
211,8,4,4,4,4,3,4,4,4,4,"Advanced testing strategy development and automation capabilities","Intelligent testing strategy with automated test generation","Could revolutionize how comprehensive testing strategies are developed",Professional,Expert,Large,Multiple
212,7,4,3,4,4,2,3,4,3,4,"Integration with design systems and component libraries is limited","Design system integration with component-aware code generation","Could generate code that properly uses existing design systems",Professional,Senior,Medium,React
213,9,4,5,4,4,4,4,5,4,4,"Advanced security analysis with threat modeling capabilities","Comprehensive security analysis and threat modeling integration","Could build security considerations into development workflow",Professional,Expert,Enterprise,Multiple
214,4,2,1,2,2,1,2,2,2,2,"Agent mode creates more technical debt than productive code","Fundamental rethinking of automated code generation quality","Current implementation prioritizes speed over code quality",Professional,Expert,Large,Rust
215,8,4,4,4,4,3,4,4,4,4,"Advanced data architecture and modeling assistance needed","Intelligent data modeling with architecture recommendations","Could help design better data architectures and schemas",Professional,Senior,Large,SQL
216,6,3,2,3,3,3,3,3,3,3,"Initial setup and configuration complexity is a major barrier","Streamlined setup with intelligent configuration detection","Too complex for quick adoption and experimentation",Professional,Mid,Small,Multiple
