ResponseID,NPS_Score,Overall_Satisfaction,Agent_Mode_Rating,Code_Completion_Rating,Chat_Edit_Rating,Next_Edit_Suggestions_Rating,Model_Choice_Rating,Enterprise_Features_Rating,Performance_Rating,Ease_of_Use_Rating,What_Dont_You_Like,What_Would_You_Like_Added,General_Comments,User_Type,Experience_Level,Company_Size,Primary_Language
217,9,5,5,4,5,4,5,4,4,4,"Advanced machine learning workflow integration and automation","ML-aware development with model deployment automation","Could revolutionize machine learning development workflows",Professional,Expert,Large,Python
218,7,3,3,4,3,2,3,3,3,3,"Code generation quality is inconsistent across different languages","More consistent quality and capability across all supported languages","Much better for some languages than others",Professional,Senior,Medium,Multiple
219,8,4,4,4,4,3,4,4,4,4,"Advanced project analysis with technical debt quantification","Comprehensive project health metrics with actionable insights","Could help prioritize technical debt and improvement efforts",Professional,Expert,Large,TypeScript
220,5,2,2,2,3,2,2,3,2,2,"Documentation and learning resources are fragmented and incomplete","Unified, comprehensive documentation with practical examples","Hard to find authoritative answers to specific questions",Student,Intermediate,Small,Multiple
221,9,4,5,4,4,4,4,4,4,4,"Advanced prompt optimization with machine learning feedback","AI-powered prompt improvement and effectiveness optimization","Could continuously improve interactions based on success patterns",Professional,Expert,Medium,Multiple
222,6,3,3,3,3,2,3,3,3,3,"Integration with project management workflows is superficial","Deep integration with agile workflows and project tracking","Could connect code generation directly to sprint planning",Professional,Mid,Large,Multiple
223,8,4,4,4,4,3,4,4,4,4,"Advanced code review automation with intelligent analysis","Comprehensive automated code review with quality insights","Could significantly improve code review efficiency and quality",Professional,Expert,Large,Java
224,7,4,3,4,4,2,3,4,3,4,"Multi-repository and microservices support needs major improvement","Better understanding of distributed system architectures","Struggles with complex, multi-service development environments",Professional,Senior,Enterprise,Multiple
225,9,5,4,5,5,4,5,5,4,5,"Advanced analytics for measuring team productivity and collaboration","Comprehensive team productivity insights and optimization","Could help optimize entire development organization effectiveness",Professional,Expert,Enterprise,Multiple
226,4,2,1,2,2,1,2,2,2,2,"Feature reliability issues make it unsuitable for critical projects","Stability and reliability must be prioritized over new features","Too many experimental features that don't work consistently",Professional,Senior,Large,C#
227,8,4,4,4,4,3,4,4,4,4,"Advanced API design assistance with best practice enforcement","Intelligent API design with governance and standards enforcement","Could help design better APIs that follow organizational standards",Professional,Senior,Medium,Multiple
228,6,3,2,3,3,3,3,3,3,3,"Learning curve for effective usage is much steeper than expected","Progressive learning tools and guided skill development","Takes significant time investment to become truly productive",Professional,Mid,Medium,Multiple
229,9,4,5,4,4,4,4,4,4,4,"Advanced code migration tools for framework and language transitions","Intelligent migration assistance for complex code modernization","Could automate difficult migration and modernization projects",Professional,Expert,Large,Multiple
230,7,3,3,4,3,2,3,3,3,3,"Suggestion relevance varies dramatically based on project context","Much better project context understanding and adaptation","Great for some projects but poor for others",Professional,Senior,Large,Python
231,8,4,4,4,4,3,4,4,4,4,"Advanced performance profiling integration with optimization recommendations","Real-time performance analysis with intelligent optimization","Could identify and resolve performance issues during development",Professional,Expert,Large,C++
232,5,3,2,3,3,2,3,3,2,3,"Support quality and response times are inadequate for professional use","Dedicated support tiers with guaranteed response times","Current support is insufficient for business-critical usage",Professional,Mid,Medium,Multiple
233,9,5,5,4,5,4,5,4,4,5,"Advanced team workflow analysis and process optimization capabilities","Intelligent workflow optimization with process improvement insights","Could help optimize entire development processes and methodologies",Professional,Expert,Enterprise,Multiple
234,6,3,3,3,3,2,3,3,3,3,"Code generation doesn't consider long-term maintainability implications","Maintainability-focused generation with technical debt prevention","Generated code often creates maintenance challenges later",Professional,Senior,Large,Java
235,8,4,4,4,4,3,4,4,4,4,"Advanced testing automation with comprehensive coverage analysis","Intelligent test strategy with automated coverage optimization","Could revolutionize how testing strategies are developed and executed",Professional,Expert,Large,Multiple
236,7,4,3,4,4,2,3,4,3,4,"Integration with continuous learning and developer skill improvement","Personalized learning recommendations based on development patterns","Could help developers improve skills through intelligent feedback",Professional,Mid,Medium,Multiple
237,9,4,5,4,4,4,4,5,4,4,"Advanced enterprise customization with industry-specific adaptations","Industry-specific templates and compliance integration","Could adapt to specific industry requirements and regulations",Professional,Expert,Enterprise,Multiple
238,4,2,1,2,2,1,2,2,2,2,"Quality control for generated code is fundamentally insufficient","Rigorous validation and testing of all AI-generated output","Places too much burden on developers to verify correctness",Professional,Expert,Large,Rust
239,8,4,4,4,4,3,4,4,4,4,"Advanced dependency management with security and license analysis","Intelligent dependency optimization with security scanning","Could prevent security and licensing issues in dependencies",Professional,Senior,Enterprise,Multiple
240,6,3,3,3,3,2,3,3,3,3,"Team adoption and change management resources are inadequate","Comprehensive change management and adoption assistance","Difficult to successfully implement across larger development teams",Professional,Mid,Large,Multiple
241,9,5,4,5,5,4,5,4,4,4,"Advanced prompt engineering tools with collaborative template management","Enterprise-grade prompt management with team collaboration","Could standardize and optimize AI interactions across organizations",Professional,Expert,Large,TypeScript
242,7,3,3,4,3,2,3,3,3,3,"Code generation often misses critical error handling and edge cases","Comprehensive error handling and edge case analysis","Generated code works for happy paths but fails in real scenarios",Professional,Senior,Medium,Python
243,8,4,4,4,4,3,4,4,4,4,"Advanced architecture analysis with modernization recommendations","Intelligent architecture assessment and improvement guidance","Could help modernize and improve existing software architectures",Professional,Expert,Large,Multiple
244,5,2,2,2,3,2,2,3,2,2,"Documentation quality is poor and examples are often outdated","Comprehensive, up-to-date documentation with working examples","Current documentation is fragmented and lacks practical guidance",Student,Intermediate,Small,Multiple
245,9,4,5,4,4,4,4,4,4,4,"Advanced collaboration features for distributed team development","Enhanced remote collaboration with shared development intelligence","Could transform how geographically distributed teams collaborate",Professional,Senior,Large,Multiple
246,6,3,2,3,3,3,3,3,3,3,"Performance impact on development environment is significant","Better optimization and reduced resource consumption","Noticeably slows down IDE and increases system resource usage",Professional,Mid,Medium,Multiple
247,8,4,4,4,4,3,4,4,4,4,"Advanced project health monitoring with predictive analytics","Comprehensive project health analysis with predictive insights","Could predict and prevent project issues before they occur",Professional,Expert,Large,Java
248,7,4,3,4,4,2,3,4,3,4,"Integration with modern development tools and workflows needs improvement","Better integration with contemporary development toolchains","Could be more deeply integrated with modern development ecosystems",Professional,Senior,Medium,Multiple
249,9,5,5,4,5,4,5,5,4,5,"Advanced enterprise governance with automated compliance checking","Comprehensive governance automation with policy enforcement","Excellent foundation but needs better enterprise control capabilities",Professional,Expert,Enterprise,Multiple
250,4,2,1,2,2,1,2,2,2,2,"Current implementation reliability makes it unsuitable for serious development","Complete focus on reliability and consistency before feature expansion","Too many unreliable features that create more problems than solutions",Professional,Expert,Large,C#